{
  "schemaId": "capture.activity_catalog/1",
  "catalogVersion": "1",
  "description": "Starter activity set for radar-to-kinematics multimodal capture",
  "captureProtocolVersion": "1",
  "activities": [
    {
      "activityId": "static_baseline",
      "displayName": "Static baseline — arms at sides",
      "durationS": 30,
      "repetitionsExpected": 0,
      "side": "none",
      "jointsExercised": ["shoulder", "elbow", "wrist"],
      "radarVisibilityNotes": "Minimal motion; clutter reference",
      "minPoseDetectionRate": 0.9,
      "category": "baseline",
      "operatorScript": "Stand facing camera, arms relaxed at sides, hold still."
    },
    {
      "activityId": "elbow_flex_slow_L",
      "displayName": "Slow elbow flexion — left",
      "durationS": 45,
      "repetitionsExpected": 10,
      "side": "L",
      "jointsExercised": ["elbow_L"],
      "radarVisibilityNotes": "Keep upper arm visible to radar LOS",
      "minPoseDetectionRate": 0.85,
      "category": "elbow",
      "operatorScript": "Left arm only, slow full elbow flexion/extension, 10 reps."
    },
    {
      "activityId": "elbow_flex_slow_R",
      "displayName": "Slow elbow flexion — right",
      "durationS": 45,
      "repetitionsExpected": 10,
      "side": "R",
      "jointsExercised": ["elbow_R"],
      "radarVisibilityNotes": "Keep upper arm visible to radar LOS",
      "minPoseDetectionRate": 0.85,
      "category": "elbow",
      "operatorScript": "Right arm only, slow full elbow flexion/extension, 10 reps."
    },
    {
      "activityId": "elbow_flex_fast_L",
      "displayName": "Fast elbow flexion — left",
      "durationS": 30,
      "repetitionsExpected": 15,
      "side": "L",
      "jointsExercised": ["elbow_L"],
      "radarVisibilityNotes": "Higher Doppler spread",
      "minPoseDetectionRate": 0.85,
      "category": "elbow",
      "operatorScript": "Left arm, rapid elbow flexion/extension, 15 reps."
    },
    {
      "activityId": "elbow_flex_fast_R",
      "displayName": "Fast elbow flexion — right",
      "durationS": 30,
      "repetitionsExpected": 15,
      "side": "R",
      "jointsExercised": ["elbow_R"],
      "radarVisibilityNotes": "Higher Doppler spread",
      "minPoseDetectionRate": 0.85,
      "category": "elbow",
      "operatorScript": "Right arm, rapid elbow flexion/extension, 15 reps."
    },
    {
      "activityId": "shoulder_abduction_L",
      "displayName": "Shoulder abduction arc — left",
      "durationS": 45,
      "repetitionsExpected": 8,
      "side": "L",
      "jointsExercised": ["shoulder_L", "elbow_L"],
      "radarVisibilityNotes": "Arm elevation changes radial velocity",
      "minPoseDetectionRate": 0.85,
      "category": "shoulder",
      "operatorScript": "Left arm abduction 0–90° and return, 8 slow reps."
    },
    {
      "activityId": "shoulder_abduction_R",
      "displayName": "Shoulder abduction arc — right",
      "durationS": 45,
      "repetitionsExpected": 8,
      "side": "R",
      "jointsExercised": ["shoulder_R", "elbow_R"],
      "radarVisibilityNotes": "Arm elevation changes radial velocity",
      "minPoseDetectionRate": 0.85,
      "category": "shoulder",
      "operatorScript": "Right arm abduction 0–90° and return, 8 slow reps."
    },
    {
      "activityId": "reach_forward_hold",
      "displayName": "Forward reach and hold",
      "durationS": 40,
      "repetitionsExpected": 5,
      "side": "bilateral",
      "jointsExercised": ["shoulder", "elbow", "wrist"],
      "radarVisibilityNotes": "Extended arm increases range gate response",
      "minPoseDetectionRate": 0.85,
      "category": "compound",
      "operatorScript": "Reach forward to target, hold 2 s, return; 5 reps alternating arms."
    },
    {
      "activityId": "fine_wrist_L",
      "displayName": "Fine wrist motion — left",
      "durationS": 30,
      "repetitionsExpected": 20,
      "side": "L",
      "jointsExercised": ["wrist_L"],
      "radarVisibilityNotes": "Low amplitude; SNR may be weak",
      "minPoseDetectionRate": 0.8,
      "category": "wrist",
      "operatorScript": "Left forearm steady, wrist flex/extend and pron/sup, 20 reps."
    },
    {
      "activityId": "fine_wrist_R",
      "displayName": "Fine wrist motion — right",
      "durationS": 30,
      "repetitionsExpected": 20,
      "side": "R",
      "jointsExercised": ["wrist_R"],
      "radarVisibilityNotes": "Low amplitude; SNR may be weak",
      "minPoseDetectionRate": 0.8,
      "category": "wrist",
      "operatorScript": "Right forearm steady, wrist flex/extend and pron/sup, 20 reps."
    },
    {
      "activityId": "surgical_reach_retract_L",
      "displayName": "Surgical-like reach and retract — left",
      "durationS": 60,
      "repetitionsExpected": 10,
      "side": "L",
      "jointsExercised": ["shoulder_L", "elbow_L", "wrist_L"],
      "radarVisibilityNotes": "Compound motion; primary eval activity",
      "minPoseDetectionRate": 0.85,
      "category": "compound",
      "operatorScript": "Left arm reach to mock field, retract to body, 10 reps at natural pace."
    },
    {
      "activityId": "surgical_reach_retract_R",
      "displayName": "Surgical-like reach and retract — right",
      "durationS": 60,
      "repetitionsExpected": 10,
      "side": "R",
      "jointsExercised": ["shoulder_R", "elbow_R", "wrist_R"],
      "radarVisibilityNotes": "Compound motion; primary eval activity",
      "minPoseDetectionRate": 0.85,
      "category": "compound",
      "operatorScript": "Right arm reach to mock field, retract to body, 10 reps at natural pace."
    },
    {
      "activityId": "walk_in_place",
      "displayName": "Walk in place",
      "durationS": 30,
      "repetitionsExpected": 0,
      "side": "bilateral",
      "jointsExercised": ["shoulder", "elbow"],
      "radarVisibilityNotes": "Whole-body clutter; negative control for arm-only model",
      "minPoseDetectionRate": 0.8,
      "category": "locomotion",
      "operatorScript": "Walk in place 30 s, arms swing naturally."
    },
    {
      "activityId": "seated_upper_body",
      "displayName": "Seated upper-body motion",
      "durationS": 45,
      "repetitionsExpected": 0,
      "side": "bilateral",
      "jointsExercised": ["shoulder", "elbow"],
      "radarVisibilityNotes": "Torso clutter differs from standing",
      "minPoseDetectionRate": 0.85,
      "category": "posture",
      "operatorScript": "Seated, perform mixed arm motions as directed for 45 s."
    },
    {
      "activityId": "standing_bilateral_symmetric",
      "displayName": "Standing bilateral symmetric arcs",
      "durationS": 45,
      "repetitionsExpected": 8,
      "side": "bilateral",
      "jointsExercised": ["shoulder", "elbow"],
      "radarVisibilityNotes": "Both arms in field",
      "minPoseDetectionRate": 0.85,
      "category": "shoulder",
      "operatorScript": "Both arms abduct symmetrically, 8 slow reps."
    },
    {
      "activityId": "garment_scrubs",
      "displayName": "Activity block in scrubs (if applicable)",
      "durationS": 60,
      "repetitionsExpected": 0,
      "side": "bilateral",
      "jointsExercised": ["shoulder", "elbow", "wrist"],
      "radarVisibilityNotes": "Fabric micro-Doppler",
      "minPoseDetectionRate": 0.85,
      "category": "garment",
      "operatorScript": "Repeat elbow + reach subset in standard scrubs."
    },
    {
      "activityId": "garment_lead",
      "displayName": "Activity block with lead (if applicable)",
      "durationS": 60,
      "repetitionsExpected": 0,
      "side": "bilateral",
      "jointsExercised": ["shoulder", "elbow"],
      "radarVisibilityNotes": "Heavy clutter expected",
      "minPoseDetectionRate": 0.8,
      "category": "garment",
      "operatorScript": "Repeat elbow + reach subset wearing lead; note radar saturation risk."
    }
  ]
}
